{
  "$schema": "../../../../../governance/schemas/scaffold.schema.json",
  "id": "ecommerce-lite",
  "version": "0.1.0",
  "label": "Ecommerce Lite",
  "description": "Minimal product-focused storefront for small shops, premium single-brand sites and product catalogues. Runs on the harmonised commerce-base starter. Built-in commerce features (cart, checkout, payments) remain hard Dossier capabilities and are intentionally absent from the scaffold baseline.",
  "buildIntent": ["website"],
  "primaryJobs": [
    "introduce the brand",
    "showcase products",
    "drive checkout intent"
  ],
  "defaultPageCount": 4,
  "supportsSinglePage": false,
  "supportsMultiPage": true,
  "supportsAppFeatures": false
}
